{
  "$schema": "https://www.cooki-ui.design/schema/registry-item.json",
  "name": "hold-to-confirm-button",
  "type": "registry:ui",
  "title": "Hold to Confirm Action Button",
  "description": "Critical action button requiring sustained mouse hold with radial charging SVG progress ring before dispatching confirmation event.",
  "category": "buttons",
  "dependencies": [
    "framer-motion",
    "@phosphor-icons/react"
  ],
  "files": [
    {
      "path": "registry/buttons/hold-to-confirm-button/hold-to-confirm-button.tsx",
      "type": "registry:ui",
      "target": "components/ui/hold-to-confirm-button.tsx",
      "content": "import React, { useState, useRef, useEffect } from 'react';\r\nimport { motion } from 'framer-motion';\r\nimport { ShieldWarning, Check } from '@phosphor-icons/react';\r\n\r\nexport const HoldToConfirmButton: React.FC = () => {\r\n  const [progress, setProgress] = useState(0);\r\n  const [isHolding, setIsHolding] = useState(false);\r\n  const [isConfirmed, setIsConfirmed] = useState(false);\r\n  const timerRef = useRef<number | null>(null);\r\n\r\n  useEffect(() => {\r\n    return () => {\r\n      if (timerRef.current) cancelAnimationFrame(timerRef.current);\r\n    };\r\n  }, []);\r\n\r\n  const startHold = () => {\r\n    if (isConfirmed) return;\r\n    setIsHolding(true);\r\n    const startTime = Date.now();\r\n    const duration = 1400;\r\n\r\n    const tick = () => {\r\n      const elapsed = Date.now() - startTime;\r\n      const pct = Math.min(100, (elapsed / duration) * 100);\r\n      setProgress(pct);\r\n      if (pct < 100) {\r\n        timerRef.current = requestAnimationFrame(tick);\r\n      } else {\r\n        setIsConfirmed(true);\r\n        setIsHolding(false);\r\n      }\r\n    };\r\n    timerRef.current = requestAnimationFrame(tick);\r\n  };\r\n\r\n  const cancelHold = () => {\r\n    if (isConfirmed) return;\r\n    setIsHolding(false);\r\n    setProgress(0);\r\n    if (timerRef.current) cancelAnimationFrame(timerRef.current);\r\n  };\r\n\r\n  const reset = () => {\r\n    setIsConfirmed(false);\r\n    setProgress(0);\r\n  };\r\n\r\n  return (\r\n    <div className=\"flex flex-col items-center gap-3\">\r\n      <button\r\n        onMouseDown={startHold}\r\n        onMouseUp={cancelHold}\r\n        onMouseLeave={cancelHold}\r\n        onTouchStart={startHold}\r\n        onTouchEnd={cancelHold}\r\n        className={`relative overflow-hidden px-6 py-3 rounded-2xl font-mono text-xs font-bold transition-all select-none cursor-pointer border ${\r\n          isConfirmed\r\n            ? 'bg-emerald-500 text-white border-emerald-400 shadow-lg shadow-emerald-500/20'\r\n            : 'bg-zinc-900 dark:bg-white text-white dark:text-zinc-950 border-zinc-800 dark:border-white/20 hover:scale-[1.02] active:scale-[0.98]'\r\n        }`}\r\n      >\r\n        {/* Fill Background Track */}\r\n        {isHolding && (\r\n          <div\r\n            style={{ width: `${progress}%` }}\r\n            className=\"absolute inset-0 bg-rose-500/40 pointer-events-none transition-all duration-75\"\r\n          />\r\n        )}\r\n\r\n        <div className=\"relative z-10 flex items-center gap-2\">\r\n          {isConfirmed ? (\r\n            <>\r\n              <Check size={14} weight=\"bold\" />\r\n              <span>TERMINATION CONFIRMED</span>\r\n            </>\r\n          ) : (\r\n            <>\r\n              <ShieldWarning size={14} weight=\"bold\" className={isHolding ? 'text-rose-400 animate-pulse' : ''} />\r\n              <span>{isHolding ? `HOLDING (${Math.round(progress)}%)` : 'HOLD TO PURGE CLUSTER'}</span>\r\n            </>\r\n          )}\r\n        </div>\r\n      </button>\r\n\r\n      {isConfirmed && (\r\n        <button\r\n          onClick={reset}\r\n          className=\"text-[11px] font-mono text-zinc-500 hover:text-zinc-900 dark:hover:text-white underline cursor-pointer\"\r\n        >\r\n          Reset Trigger\r\n        </button>\r\n      )}\r\n    </div>\r\n  );\r\n};\r\n"
    }
  ]
}