{
  "$schema": "https://www.cooki-ui.design/schema/registry-item.json",
  "name": "context-action-menu",
  "type": "registry:ui",
  "title": "Context Action Menu",
  "description": "Desktop-style right-click context menu with keyboard shortcuts, destructive actions, and submenus.",
  "category": "overlays",
  "dependencies": [
    "framer-motion",
    "@phosphor-icons/react"
  ],
  "files": [
    {
      "path": "registry/overlays/context-action-menu/context-action-menu.tsx",
      "type": "registry:ui",
      "target": "components/ui/context-action-menu.tsx",
      "content": "import React, { useState, useRef, useEffect } from 'react';\r\nimport { motion, AnimatePresence } from 'framer-motion';\r\nimport { Copy, Code, Trash, Play } from '@phosphor-icons/react';\r\n\r\nexport const ContextActionMenu: React.FC = () => {\r\n  const [pos, setPos] = useState<{ x: number; y: number } | null>(null);\r\n  const containerRef = useRef<HTMLDivElement>(null);\r\n\r\n  const handleContextMenu = (e: React.MouseEvent) => {\r\n    e.preventDefault();\r\n    const rect = containerRef.current?.getBoundingClientRect();\r\n    if (rect) {\r\n      setPos({ x: e.clientX - rect.left, y: e.clientY - rect.top });\r\n    }\r\n  };\r\n\r\n  useEffect(() => {\r\n    const handleClose = () => setPos(null);\r\n    window.addEventListener('click', handleClose);\r\n    return () => window.removeEventListener('click', handleClose);\r\n  }, []);\r\n\r\n  return (\r\n    <div\r\n      ref={containerRef}\r\n      onContextMenu={handleContextMenu}\r\n      className=\"relative w-full max-w-sm mx-auto h-40 rounded-3xl border-2 border-dashed border-zinc-300 dark:border-white/15 bg-zinc-100/60 dark:bg-zinc-900/40 flex flex-col items-center justify-center select-none cursor-context-menu\"\r\n    >\r\n      <span className=\"text-xs font-mono font-bold text-zinc-900 dark:text-white\">RIGHT CLICK INSIDE THIS AREA</span>\r\n      <span className=\"text-[10px] font-mono text-zinc-500 mt-1\">To trigger the custom context menu</span>\r\n\r\n      <AnimatePresence>\r\n        {pos && (\r\n          <motion.div\r\n            initial={{ opacity: 0, scale: 0.95 }}\r\n            animate={{ opacity: 1, scale: 1 }}\r\n            exit={{ opacity: 0, scale: 0.95 }}\r\n            transition={{ duration: 0.12 }}\r\n            style={{ top: pos.y, left: pos.x }}\r\n            className=\"absolute z-50 w-48 rounded-2xl border border-zinc-200 dark:border-white/15 bg-white dark:bg-zinc-950 p-1.5 shadow-2xl font-mono text-xs text-zinc-800 dark:text-zinc-200\"\r\n          >\r\n            <button className=\"flex w-full items-center justify-between px-2.5 py-1.5 rounded-xl hover:bg-zinc-100 dark:hover:bg-white/10 transition-colors cursor-pointer\">\r\n              <span className=\"flex items-center gap-2\"><Copy size={13} /> Copy Path</span>\r\n              <span className=\"text-[10px] text-zinc-400\">⌘C</span>\r\n            </button>\r\n            <button className=\"flex w-full items-center justify-between px-2.5 py-1.5 rounded-xl hover:bg-zinc-100 dark:hover:bg-white/10 transition-colors cursor-pointer\">\r\n              <span className=\"flex items-center gap-2\"><Code size={13} /> View AST</span>\r\n              <span className=\"text-[10px] text-zinc-400\">⌥V</span>\r\n            </button>\r\n            <button className=\"flex w-full items-center justify-between px-2.5 py-1.5 rounded-xl hover:bg-zinc-100 dark:hover:bg-white/10 transition-colors cursor-pointer\">\r\n              <span className=\"flex items-center gap-2\"><Play size={13} /> Run Kernel</span>\r\n              <span className=\"text-[10px] text-zinc-400\">↵</span>\r\n            </button>\r\n            <div className=\"my-1 border-t border-zinc-200 dark:border-white/10\" />\r\n            <button className=\"flex w-full items-center justify-between px-2.5 py-1.5 rounded-xl hover:bg-rose-500/10 text-rose-500 transition-colors cursor-pointer\">\r\n              <span className=\"flex items-center gap-2\"><Trash size={13} /> Delete Block</span>\r\n              <span className=\"text-[10px]\">⌫</span>\r\n            </button>\r\n          </motion.div>\r\n        )}\r\n      </AnimatePresence>\r\n    </div>\r\n  );\r\n};\r\n"
    }
  ]
}