{
  "$schema": "https://www.cooki-ui.design/schema/registry-item.json",
  "name": "status-radar-badge",
  "type": "registry:ui",
  "title": "Status Radar Badge",
  "description": "Live telemetry system status indicator badge with pulse sonar ring and calibrated state switches.",
  "category": "feedback",
  "dependencies": [
    "framer-motion"
  ],
  "files": [
    {
      "path": "registry/feedback/status-radar-badge/status-radar-badge.tsx",
      "type": "registry:ui",
      "target": "components/ui/status-radar-badge.tsx"
    }
  ]
}
