{
  "name": "video-text-mask",
  "type": "registry:ui",
  "title": "Video Text Mask",
  "description": "Dynamic looping video masked inside responsive SVG typography with fluid background illumination.",
  "dependencies": [
    "framer-motion"
  ],
  "files": [
    {
      "path": "registry/text/video-text-mask/video-text-mask.tsx",
      "type": "registry:ui",
      "target": "components/ui/video-text-mask.tsx",
      "content": "import React, { ReactNode, useEffect, useState, useRef } from \"react\";\nimport { motion, HTMLMotionProps } from \"framer-motion\";\nimport { cn } from \"@/lib/utils\";\n\nexport interface VideoTextMaskProps {\n  src?: string;\n  className?: string;\n  autoPlay?: boolean;\n  muted?: boolean;\n  loop?: boolean;\n  preload?: \"auto\" | \"metadata\" | \"none\";\n  children: ReactNode;\n  fontSize?: string | number;\n  fontWeight?: string | number;\n  textAnchor?: string;\n  dominantBaseline?: string;\n  fontFamily?: string;\n  as?: \"div\" | \"span\" | \"section\" | \"article\" | \"p\" | \"h1\" | \"h2\" | \"h3\" | \"h4\" | \"h5\" | \"h6\";\n}\n\nexport function VideoTextMask({\n  src = \"https://assets.mixkit.co/videos/preview/mixkit-fluid-lines-moving-in-slow-motion-41857-large.mp4\",\n  children,\n  className = \"\",\n  autoPlay = true,\n  muted = true,\n  loop = true,\n  preload = \"auto\",\n  fontSize = \"16vw\",\n  fontWeight = \"900\",\n  textAnchor = \"middle\",\n  dominantBaseline = \"middle\",\n  fontFamily = \"system-ui, -apple-system, sans-serif\",\n  as = \"div\",\n  ...motionProps\n}: VideoTextMaskProps & HTMLMotionProps<\"div\">) {\n  const [svgMask, setSvgMask] = useState(\"\");\n  const [videoLoaded, setVideoLoaded] = useState(false);\n  const [videoError, setVideoError] = useState(false);\n  const videoRef = useRef<HTMLVideoElement>(null);\n  const content = React.Children.toArray(children).join(\"\");\n\n  useEffect(() => {\n    const responsiveFontSize =\n      typeof fontSize === \"number\" ? `${fontSize}px` : fontSize;\n\n    const newSvgMask = `<svg xmlns='http://www.w3.org/2000/svg' width='100%' height='100%' viewBox='0 0 1000 300'>\n      <text x='50%' y='50%'\n            font-size='${responsiveFontSize}'\n            font-weight='${fontWeight}'\n            text-anchor='${textAnchor}'\n            dominant-baseline='${dominantBaseline}'\n            font-family='${fontFamily}'\n            letter-spacing='-0.03em'\n            fill='black'>${content}</text>\n    </svg>`;\n    setSvgMask(newSvgMask);\n  }, [content, fontSize, fontWeight, textAnchor, dominantBaseline, fontFamily]);\n\n  useEffect(() => {\n    const vid = videoRef.current;\n    if (!vid) return;\n\n    const handleCanPlay = () => setVideoLoaded(true);\n    const handleError = () => setVideoError(true);\n\n    vid.addEventListener(\"canplay\", handleCanPlay);\n    vid.addEventListener(\"error\", handleError);\n\n    // Attempt autoplay safely\n    if (autoPlay) {\n      vid.play().catch(() => {\n        // Autoplay may be restricted by browser policy; fallback gradient shines through\n      });\n    }\n\n    return () => {\n      vid.removeEventListener(\"canplay\", handleCanPlay);\n      vid.removeEventListener(\"error\", handleError);\n    };\n  }, [src, autoPlay]);\n\n  const validTags = [\"div\", \"span\", \"section\", \"article\", \"p\", \"h1\", \"h2\", \"h3\", \"h4\", \"h5\", \"h6\"] as const;\n  type ValidTag = (typeof validTags)[number];\n  const MotionComponent = motion[validTags.includes(as) ? as : \"div\"] as any;\n\n  if (!svgMask) {\n    return React.createElement(\n      MotionComponent,\n      {\n        className: cn(\"relative size-full\", className),\n        ...motionProps,\n      },\n      <span className=\"sr-only\">{content}</span>\n    );\n  }\n\n  const dataUrlMask = `url(\"data:image/svg+xml,${encodeURIComponent(svgMask)}\")`;\n\n  return React.createElement(\n    MotionComponent,\n    {\n      className: cn(\n        \"relative w-full h-48 sm:h-56 overflow-hidden rounded-xl bg-zinc-950 flex items-center justify-center select-none shadow-2xl\",\n        className\n      ),\n      ...motionProps,\n    },\n    <>\n      <div\n        className=\"absolute inset-0 flex items-center justify-center pointer-events-none\"\n        style={{\n          maskImage: dataUrlMask,\n          WebkitMaskImage: dataUrlMask,\n          maskSize: \"contain\",\n          WebkitMaskSize: \"contain\",\n          maskRepeat: \"no-repeat\",\n          WebkitMaskRepeat: \"no-repeat\",\n          maskPosition: \"center\",\n          WebkitMaskPosition: \"center\",\n        }}\n      >\n        {/* Animated Cyber Aurora Fluid Fallback (Always active & shining through) */}\n        <div className=\"absolute inset-0 bg-gradient-to-tr from-indigo-600 via-purple-600 to-cyan-400 overflow-hidden\">\n          <motion.div\n            animate={{\n              scale: [1, 1.25, 1],\n              rotate: [0, 90, 180, 270, 360],\n              x: [-20, 20, -20],\n              y: [-10, 15, -10],\n            }}\n            transition={{\n              duration: 8,\n              repeat: Infinity,\n              ease: \"linear\",\n            }}\n            className=\"absolute -inset-[50%] bg-[radial-gradient(ellipse_at_center,_var(--tw-gradient-stops))] from-cyan-400 via-indigo-500 to-rose-500 opacity-80 blur-xl\"\n          />\n        </div>\n\n        {/* Video stream layered on top if available */}\n        {!videoError && src && (\n          <video\n            ref={videoRef}\n            className={cn(\n              \"absolute inset-0 w-full h-full object-cover scale-105 transition-opacity duration-700\",\n              videoLoaded ? \"opacity-100\" : \"opacity-0\"\n            )}\n            autoPlay={autoPlay}\n            muted={muted}\n            loop={loop}\n            preload={preload}\n            playsInline\n          >\n            <source src={src} type=\"video/mp4\" />\n          </video>\n        )}\n      </div>\n      <span className=\"sr-only\">{content}</span>\n    </>\n  );\n}\n\nexport default VideoTextMask;\n"
    }
  ],
  "$schema": "https://www.cooki-ui.design/schema/registry-item.json"
}