{
  "$schema": "https://www.cooki-ui.design/schema/registry-item.json",
  "name": "flowing-lines-wave-background",
  "type": "registry:ui",
  "title": "Mathematical Flowing Lines Wave",
  "description": "Continuous algorithmic bezier ribbon canvas drawing undulating sine wave threads across deep space.",
  "category": "backgrounds",
  "dependencies": [],
  "files": [
    {
      "path": "registry/backgrounds/flowing-lines-wave-background/flowing-lines-wave-background.tsx",
      "type": "registry:ui",
      "target": "components/ui/flowing-lines-wave-background.tsx",
      "content": "import React, { useRef, useEffect } from 'react';\r\n\r\nexport const FlowingLinesWaveBackground: React.FC = () => {\r\n  const canvasRef = useRef<HTMLCanvasElement>(null);\r\n\r\n  useEffect(() => {\r\n    const canvas = canvasRef.current;\r\n    if (!canvas) return;\r\n    const ctx = canvas.getContext('2d');\r\n    if (!ctx) return;\r\n\r\n    let animId: number;\r\n    let step = 0;\r\n    let isVisible = true;\r\n\r\n    const render = () => {\r\n      if (!isVisible) return;\r\n      ctx.fillStyle = 'rgba(5, 5, 8, 0.2)';\r\n      ctx.fillRect(0, 0, canvas.width, canvas.height);\r\n\r\n      const lines = 7;\r\n      for (let i = 0; i < lines; i++) {\r\n        ctx.beginPath();\r\n        ctx.lineWidth = 1.2;\r\n        ctx.strokeStyle = `hsla(${230 + i * 15}, 85%, 65%, 0.45)`;\r\n\r\n        for (let x = 0; x < canvas.width; x += 5) {\r\n          const y =\r\n            canvas.height / 2 +\r\n            Math.sin((x * 0.008) + step + i * 0.4) * 45 +\r\n            Math.cos((x * 0.004) - step) * 20;\r\n          if (x === 0) ctx.moveTo(x, y);\r\n          else ctx.lineTo(x, y);\r\n        }\r\n        ctx.stroke();\r\n      }\r\n\r\n      step += 0.025;\r\n      animId = requestAnimationFrame(render);\r\n    };\r\n\r\n    animId = requestAnimationFrame(render);\r\n\r\n    const handleResize = () => {\r\n      const rect = canvas.getBoundingClientRect();\r\n      if (rect.width > 0 && rect.height > 0) {\r\n        canvas.width = rect.width;\r\n        canvas.height = rect.height;\r\n      }\r\n    };\r\n    handleResize();\r\n    const resizeObserver = new ResizeObserver(handleResize);\r\n    resizeObserver.observe(canvas);\r\n\r\n    const observer = new IntersectionObserver(([entry]) => {\r\n      const wasVisible = isVisible;\r\n      isVisible = entry.isIntersecting;\r\n      if (isVisible && !wasVisible) {\r\n        animId = requestAnimationFrame(render);\r\n      }\r\n    }, { threshold: 0.05 });\r\n    observer.observe(canvas);\r\n\r\n    return () => {\r\n      cancelAnimationFrame(animId);\r\n      observer.disconnect();\r\n      resizeObserver.disconnect();\r\n    };\r\n  }, []);\r\n\r\n  return (\r\n    <div className=\"relative w-full h-56 rounded-2xl overflow-hidden bg-black border border-white/10 flex items-center justify-center\">\r\n      <canvas ref={canvasRef} className=\"w-full h-full\" />\r\n      <span className=\"absolute z-10 px-3 py-1 rounded-full bg-zinc-900/80 text-white text-[10px] font-mono border border-white/10 backdrop-blur-md\">\r\n        SINUSOIDAL RIBBON THREADS\r\n      </span>\r\n    </div>\r\n  );\r\n};\r\n"
    }
  ]
}